<?xml version='1.0' encoding='utf-8'?>
<!DOCTYPE list SYSTEM "zone.dtd">
<list>
	<zone name="[kasha1]" type="dummy">
		<polygon>
			<coords loc="70136 -124744 -3300 -3000"/>
			<coords loc="69672 -125224 -3300 -3000"/>
			<coords loc="69800 -126104 -3300 -3000"/>
			<coords loc="70968 -126664 -3300 -3000"/>
			<coords loc="71848 -126168 -3300 -3000"/>
			<coords loc="72056 -125304 -3300 -3000"/>
			<coords loc="71592 -124584 -3300 -3000"/>
		</polygon>
	</zone>
	<zone name="[kasha2]" type="dummy">
		<polygon>
			<coords loc="73336 -122920 -3300 -2900"/>
			<coords loc="74360 -123112 -3300 -2900"/>
			<coords loc="75544 -122280 -3300 -2900"/>
			<coords loc="76072 -121176 -3300 -2900"/>
			<coords loc="74696 -120040 -3300 -2900"/>
			<coords loc="73288 -120376 -3300 -2900"/>
			<coords loc="72376 -121544 -3300 -2900"/>
		</polygon>
	</zone>
	<zone name="[kasha3]" type="dummy">
		<polygon>
			<coords loc="69000 -122712 -3200 -2700"/>
			<coords loc="68168 -123496 -3200 -2700"/>
			<coords loc="66872 -123416 -3200 -2700"/>
			<coords loc="66344 -122520 -3200 -2700"/>
			<coords loc="66664 -121464 -3200 -2700"/>
			<coords loc="67832 -121000 -3200 -2700"/>
			<coords loc="69048 -122040 -3200 -2700"/>
		</polygon>
	</zone>
	<zone name="[kasha4]" type="dummy">
		<polygon>
			<coords loc="69272 -120232 -3000 -2300"/>
			<coords loc="68120 -118424 -3000 -2300"/>
			<coords loc="70936 -117480 -3000 -2300"/>
			<coords loc="71208 -119128 -3000 -2300"/>
			<coords loc="70552 -120008 -3000 -2300"/>
		</polygon>
	</zone>
	<zone name="[kasha5]" type="dummy">
		<polygon>
			<coords loc="73944 -117544 -2500 -2000"/>
			<coords loc="73528 -116744 -2500 -2000"/>
			<coords loc="73768 -116296 -2500 -2000"/>
			<coords loc="74504 -116056 -2500 -2000"/>
			<coords loc="74952 -116360 -2500 -2000"/>
			<coords loc="75160 -116808 -2500 -2000"/>
			<coords loc="75032 -117240 -2500 -2000"/>
			<coords loc="74200 -117736 -2500 -2000"/>
		</polygon>
	</zone>
	<zone name="[kasha6]" type="dummy">
		<polygon>
			<coords loc="75848 -126088 -3400 -3000"/>
			<coords loc="75128 -126360 -3400 -3000"/>
			<coords loc="74888 -127240 -3400 -3000"/>
			<coords loc="75096 -128008 -3400 -3000"/>
			<coords loc="75832 -128584 -3400 -3000"/>
			<coords loc="76472 -128568 -3400 -3000"/>
			<coords loc="77048 -128200 -3400 -3000"/>
			<coords loc="77272 -127192 -3400 -3000"/>
			<coords loc="76808 -126424 -3400 -3000"/>
		</polygon>
	</zone>
	<zone name="[kasha7]" type="dummy">
		<polygon>
			<coords loc="72616 -128616 -3700 -3200"/>
			<coords loc="72248 -129624 -3700 -3200"/>
			<coords loc="71384 -129800 -3700 -3200"/>
			<coords loc="70664 -129336 -3700 -3200"/>
			<coords loc="70584 -128648 -3700 -3200"/>
			<coords loc="71528 -127928 -3700 -3200"/>
			<coords loc="72152 -128264 -3700 -3200"/>
		</polygon>
	</zone>
	<zone name="[kasha8]" type="dummy">
		<polygon>
			<coords loc="69608 -116408 -2400 -1900"/>
			<coords loc="69352 -117224 -2400 -1900"/>
			<coords loc="67928 -117512 -2400 -1900"/>
			<coords loc="67016 -116808 -2400 -1900"/>
			<coords loc="67448 -114776 -2400 -1900"/>
			<coords loc="68456 -114584 -2400 -1900"/>
			<coords loc="69576 -115448 -2400 -1900"/>
		</polygon>
	</zone>
</list>